{
	"$schema": "./../../../schemas/AURORA.schema.json",
	"audit_history": [
		{
			"user": "copilot",
			"event": "created",
			"timestamp": "2026-01-08T00:00:00Z"
		}
	],
	"card_type": "constraint",
	"card_subtype": "threat",
	"description": "Customer PII could be exposed via logs, storage, transit, or misconfigured access controls.",
	"id": "pii_exposure",
	"name": "Threat: PII Exposure",
	"status": "proposed",
	"uuid": "34e5f607-3333-4c44-8555-cdef01234567",
	"version": "1.0.0"
}
