{
	"$schema": "./../../../schemas/AURORA.schema.json",
	"audit_history": [
		{
			"user": "copilot",
			"event": "created",
			"timestamp": "2026-01-08T00:00:00Z"
		}
	],
	"card_type": "test",
	"description": "Verifies retries do not create duplicate orders (idempotency key enforcement).",
	"id": "idempotent_order_submission_test",
	"links": [
		{
			"relationship": "validates",
			"target": "44444444-dddd-4eee-8fff-ddddeeeeffff"
		},
		{
			"relationship": "validates",
			"target": "6d777777-8888-4a99-8b00-bbbbccccdddd"
		},
		{
			"relationship": "validates",
			"target": "ab111111-cccc-4e33-8f44-ffff00001111"
		}
	],
	"name": "Idempotent Order Submission Test",
	"status": "proposed",
	"uuid": "0f0e0d0c-1234-4abc-8def-abcdef012345",
	"version": "1.0.0"
}
