{
	"$schema": "./../../../schemas/Aurora.schema.json",
	"audit_history": [
		{
			"user": "copilot",
			"event": "created",
			"timestamp": "2026-01-08T00:00:00Z"
		},
		{
			"user": "copilot",
			"event": "edited",
			"timestamp": "2026-01-10T00:00:00Z"
		}
	],
	"card_type": "requirement",
	"description": "The system shall compute order totals including taxes, fees, and promotions accurately.",
	"id": "pricing_taxes_and_promotions",
	"name": "Pricing, Taxes, and Promotions",
	"status": "proposed",
	"uuid": "33333333-cccc-4ddd-8eee-ccccddddeeee",
	"version": "2.0.0"
}
