{
	"$schema": "./../../../schemas/Aurora.schema.json",
	"audit_history": [
		{
			"user": "copilot",
			"event": "created",
			"timestamp": "2026-01-08T00:00:00Z"
		},
		{
			"user": "copilot",
			"event": "edited",
			"timestamp": "2026-01-10T00:00:00Z"
		}
	],
	"card_type": "test",
	"description": "Verifies customers receive timely order status updates (push notifications / polling).",
	"id": "order_status_push_updates_test",
	"links": [
		{
			"relationship": "validates",
			"target": "9f46f708-f701-4c34-8d9a-e56789abcdef"
		},
		{
			"relationship": "validates",
			"target": "a4b5c6d7-4444-4eee-8f12-1234567890ab"
		},
		{
			"relationship": "validates",
			"target": "92a3b4c5-2222-4d33-8444-9999aaaabbbb"
		},
		{
			"relationship": "validates",
			"target": "cd333333-eeee-4a55-8166-111122223333"
		}
	],
	"name": "Order Status Push Updates Test",
	"status": "proposed",
	"uuid": "3f3e3d3c-3456-4cde-8f01-def012345678",
	"version": "2.0.0"
}
