{
	"$schema": "./../../../schemas/AURORA.schema.json",
	"audit_history": [
		{
			"user": "copilot",
			"event": "created",
			"timestamp": "2026-01-08T00:00:00Z"
		}
	],
	"card_type": "state",
	"description": "Customer is building a cart prior to checkout.",
	"id": "cart_active",
	"links": [
		{
			"relationship": "meets",
			"target": "7c7b7a79-1111-4c22-8333-890abcdef012"
		},
		{
			"relationship": "meets",
			"target": "abababab-4444-4f55-8666-bcdef0123456"
		},
		{
			"relationship": "receives",
			"target": "01010101-aaaa-4bbb-8ccc-111111111111"
		}
	],
	"name": "Cart Active",
	"status": "proposed",
	"uuid": "0d0c0b0a-aaaa-4bbb-8ccc-123456789abc",
	"version": "1.0.0"
}
