{
	"$schema": "./../../../schemas/AURORA.schema.json",
	"audit_history": [
		{
			"user": "copilot",
			"event": "created",
			"timestamp": "2026-01-08T00:00:00Z"
		}
	],
	"card_type": "node",
	"description": "Cloud compute cluster hosting backend service components.",
	"id": "cloud_cluster",
	"links": [
		{
			"relationship": "hosts",
			"target": "7e888888-9999-4b00-8c11-ccccddddeeee"
		},
		{
			"relationship": "hosts",
			"target": "8f999999-aaaa-4c11-8d22-ddddeeeeffff"
		},
		{
			"relationship": "hosts",
			"target": "9a000000-bbbb-4d22-8e33-eeeeffff0000"
		},
		{
			"relationship": "hosts",
			"target": "ab111111-cccc-4e33-8f44-ffff00001111"
		},
		{
			"relationship": "hosts",
			"target": "bc222222-dddd-4f44-8055-000011112222"
		},
		{
			"relationship": "hosts",
			"target": "cd333333-eeee-4a55-8166-111122223333"
		}
	],
	"name": "Cloud Cluster",
	"status": "proposed",
	"uuid": "ef555555-0000-4c77-8377-333344445555",
	"version": "1.0.0"
}
