{
	"$schema": "./../../../schemas/Aurora.schema.json",
	"audit_history": [
		{
			"user": "copilot",
			"event": "created",
			"timestamp": "2026-01-08T00:00:00Z"
		},
		{
			"user": "copilot",
			"event": "edited",
			"timestamp": "2026-01-10T00:00:00Z"
		}
	],
	"card_type": "state",
	"description": "Order is ready for pickup by the customer.",
	"id": "ready_for_pickup",
	"links": [
		{
			"relationship": "meets",
			"target": "f1f2f3f4-aaaa-4bbb-8ccc-234567890abc"
		},
		{
			"relationship": "meets",
			"target": "abababab-4444-4f55-8666-bcdef0123456"
		}
	],
	"name": "Ready for Pickup",
	"status": "proposed",
	"uuid": "4f4e4d4c-eeee-4fff-8000-567890abcdef",
	"version": "2.0.0"
}
