{
	"$schema": "./../../../schemas/AURORA.schema.json",
	"audit_history": [
		{
			"user": "copilot",
			"event": "created",
			"timestamp": "2026-01-08T00:00:00Z"
		}
	],
	"card_type": "constraint",
	"card_subtype": "threat",
	"description": "Retries and network instability can cause duplicate order submissions, leading to double fulfillment and/or duplicate charges.",
	"id": "duplicate_orders_from_retries",
	"name": "Threat: Duplicate Orders From Retries",
	"status": "proposed",
	"uuid": "12c3d4e5-1111-4a22-8333-abcdef012345",
	"version": "1.0.0"
}
