{
	"$schema": "./../../../schemas/Aurora.schema.json",
	"audit_history": [
		{
			"user": "copilot",
			"event": "created",
			"timestamp": "2026-01-08T00:00:00Z"
		},
		{
			"user": "copilot",
			"event": "edited",
			"timestamp": "2026-01-10T00:00:00Z"
		}
	],
	"card_type": "event",
	"description": "Checkout flow starts.",
	"id": "checkout_started",
	"links": [
		{
			"relationship": "triggers",
			"target": "1c1b1a19-bbbb-4ccc-8ddd-234567890abc"
		}
	],
	"name": "Checkout Started",
	"status": "proposed",
	"uuid": "01010101-aaaa-4bbb-8ccc-111111111111",
	"version": "2.0.0"
}
