{
	"$schema": "./../../../schemas/Aurora.schema.json",
	"audit_history": [
		{
			"user": "copilot",
			"event": "created",
			"timestamp": "2026-01-08T00:00:00Z"
		},
		{
			"user": "copilot",
			"event": "edited",
			"timestamp": "2026-01-10T00:00:00Z"
		}
	],
	"card_type": "test",
	"description": "Verifies PII fields are minimized and stored/handled according to privacy constraints.",
	"id": "pii_minimization_storage_test",
	"links": [
		{
			"relationship": "validates",
			"target": "66666666-ffff-4a00-8111-ffff00001111"
		},
		{
			"relationship": "validates",
			"target": "bbbbbbbb-4444-4f55-8666-444455556666"
		},
		{
			"relationship": "validates",
			"target": "2b3c4d5e-bbbb-4ccc-8ddd-222233334444"
		}
	],
	"name": "PII Minimization Storage Test",
	"status": "proposed",
	"uuid": "2f2e2d2c-2345-4bcd-8ef0-cdef01234567",
	"version": "2.0.0"
}
