{
	"$schema": "./../../../schemas/AURORA.schema.json",
	"audit_history": [
		{
			"user": "copilot",
			"event": "created",
			"timestamp": "2026-01-08T00:00:00Z"
		}
	],
	"card_type": "requirement",
	"description": "The system shall protect customer PII in storage, transit, and logs.",
	"id": "protect_customer_pii",
	"links": [
		{
			"relationship": "imposes",
			"target": "bbbbbbbb-4444-4f55-8666-444455556666"
		},
		{
			"relationship": "validated_by",
			"target": "2f2e2d2c-2345-4bcd-8ef0-cdef01234567"
		}
	],
	"name": "Protect Customer PII",
	"status": "proposed",
	"uuid": "66666666-ffff-4a00-8111-ffff00001111",
	"version": "1.0.0"
}
