{
	"$schema": "./../../../schemas/Aurora.schema.json",
	"audit_history": [
		{
			"user": "copilot",
			"event": "created",
			"timestamp": "2026-01-08T00:00:00Z"
		},
		{
			"user": "copilot",
			"event": "edited",
			"timestamp": "2026-01-10T00:00:00Z"
		}
	],
	"card_type": "requirement",
	"description": "The system shall deliver submitted orders to the selected store and reflect store-provided fulfillment status to the customer.",
	"id": "store_receives_order_updates_status",
	"links": [
		{
			"relationship": "validated_by",
			"target": "4f4e4d4c-4567-4def-8f12-ef0123456789"
		}
	],
	"name": "Store Receives Order and Updates Status",
	"status": "proposed",
	"uuid": "99999999-2222-4d33-8444-222233334444",
	"version": "2.0.0"
}
