{
	"$schema": "./../../../schemas/Aurora.schema.json",
	"audit_history": [
		{
			"user": "copilot",
			"event": "created",
			"timestamp": "2026-01-08T00:00:00Z"
		},
		{
			"user": "copilot",
			"event": "edited",
			"timestamp": "2026-01-10T00:00:00Z"
		}
	],
	"card_subtype": "zone",
	"card_type": "boundary",
	"description": "Cloud-hosted environment for backend services and data stores.",
	"id": "cloud_services",
	"links": [
		{
			"relationship": "contains",
			"target": "ef555555-0000-4c77-8377-333344445555"
		},
		{
			"relationship": "contains",
			"target": "f6666666-1111-4d88-8488-444455556666"
		}
	],
	"name": "Cloud Services Zone",
	"status": "proposed",
	"uuid": "28ef8091-809a-4f0d-9c23-789abcde0123",
	"version": "2.0.0"
}
