{
	"$schema": "./../../../schemas/Aurora.schema.json",
	"audit_history": [
		{
			"user": "copilot",
			"event": "created",
			"timestamp": "2026-01-08T00:00:00Z"
		},
		{
			"user": "copilot",
			"event": "edited",
			"timestamp": "2026-01-10T00:00:00Z"
		}
	],
	"card_type": "constraint",
	"description": "Interactive customer actions (menu browsing, checkout) must complete within a latency target suitable for mobile experiences.",
	"id": "latency_slo",
	"links": [
		{
			"relationship": "limits",
			"target": "d4c3b2a1-0f98-4b76-8a54-3210fedcba98"
		},
		{
			"relationship": "limits",
			"target": "39e0f1a2-91ab-4cde-8d34-8f9012345678"
		}
	],
	"name": "Latency SLO",
	"status": "proposed",
	"uuid": "dddddddd-6666-4b77-8888-666677778888",
	"version": "2.0.0"
}
