{
	"$schema": "./../../../schemas/AURORA.schema.json",
	"audit_history": [
		{
			"user": "copilot",
			"event": "created",
			"timestamp": "2026-01-08T00:00:00Z"
		}
	],
	"card_type": "component",
	"description": "Store-side POS/kitchen system that accepts inbound orders and reports fulfillment status.",
	"id": "store_pos_system",
	"links": [
		{
			"relationship": "exposes",
			"target": "0c999999-4444-4abb-87bb-777788889999"
		}
	],
	"name": "Store POS System",
	"status": "proposed",
	"uuid": "0b888888-3333-4faa-86aa-666677778888",
	"version": "1.0.0"
}
