{
	"$schema": "./../../../schemas/Aurora.schema.json",
	"audit_history": [
		{
			"user": "copilot",
			"event": "created",
			"timestamp": "2026-01-08T00:00:00Z"
		},
		{
			"user": "copilot",
			"event": "edited",
			"timestamp": "2026-01-10T00:00:00Z"
		}
	],
	"card_type": "constraint",
	"description": "Collect and retain only the minimum customer data needed to operate ordering and fulfillment.",
	"id": "data_minimization",
	"links": [
		{
			"relationship": "limits",
			"target": "e4f5a6b7-4c56-4d89-9e8f-3a4b5c6d7e8f"
		}
	],
	"name": "Data Minimization",
	"status": "proposed",
	"uuid": "bbbbbbbb-4444-4f55-8666-444455556666",
	"version": "2.0.0"
}
