{
	"$schema": "./../../../schemas/AURORA.schema.json",
	"audit_history": [
		{
			"user": "copilot",
			"event": "created",
			"timestamp": "2026-01-08T00:00:00Z"
		}
	],
	"card_type": "test",
	"description": "Verifies the ordering API meets availability targets and degrades gracefully.",
	"id": "availability_slo_test",
	"links": [
		{
			"relationship": "validates",
			"target": "88888888-1111-4c22-8333-111122223333"
		},
		{
			"relationship": "validates",
			"target": "cccccccc-5555-4a66-8777-555566667777"
		},
		{
			"relationship": "validates",
			"target": "7e888888-9999-4b00-8c11-ccccddddeeee"
		}
	],
	"name": "Availability SLO Test",
	"status": "proposed",
	"uuid": "5f5e5d5c-5678-4ef0-8f23-f0123456789a",
	"version": "1.0.0"
}
