{
	"$schema": "./../../../schemas/Aurora.schema.json",
	"audit_history": [
		{
			"user": "copilot",
			"event": "created",
			"timestamp": "2026-01-08T00:00:00Z"
		},
		{
			"user": "copilot",
			"event": "edited",
			"timestamp": "2026-01-10T00:00:00Z"
		}
	],
	"card_type": "component",
	"description": "API gateway that authenticates requests, enforces rate limits, and routes to internal services.",
	"id": "api_gateway",
	"links": [
		{
			"relationship": "exposes",
			"target": "6d777777-8888-4a99-8b00-bbbbccccdddd"
		},
		{
			"relationship": "implements",
			"target": "c3b2a190-1e87-4a65-8b43-210fedcba987"
		}
	],
	"name": "API Gateway",
	"status": "proposed",
	"uuid": "7e888888-9999-4b00-8c11-ccccddddeeee",
	"version": "2.0.0"
}
