{
	"$schema": "./../../../schemas/AURORA.schema.json",
	"audit_history": [
		{
			"user": "copilot",
			"event": "created",
			"timestamp": "2026-01-08T00:00:00Z"
		}
	],
	"attributes": {
		"protocol": "https",
		"style": "rest"
	},
	"card_type": "interface",
	"description": "External push notification API for delivering mobile notifications.",
	"id": "push_notification_api",
	"name": "Push Notification API",
	"status": "proposed",
	"uuid": "92a3b4c5-2222-4d33-8444-9999aaaabbbb",
	"version": "1.0.0"
}
