{
	"$schema": "./../../../schemas/AURORA.schema.json",
	"audit_history": [
		{
			"user": "copilot",
			"event": "created",
			"timestamp": "2026-01-08T00:00:00Z"
		}
	],
	"card_type": "state",
	"description": "Payment authorization is in progress.",
	"id": "payment_pending",
	"links": [
		{
			"relationship": "receives",
			"target": "02020202-bbbb-4ccc-8ddd-222222222222"
		},
		{
			"relationship": "meets",
			"target": "8b8a8988-2222-4d33-8444-90abcdef0123"
		},
		{
			"relationship": "meets",
			"target": "abababab-4444-4f55-8666-bcdef0123456"
		}
	],
	"name": "Payment Pending",
	"status": "proposed",
	"uuid": "1c1b1a19-bbbb-4ccc-8ddd-234567890abc",
	"version": "1.0.0"
}
