{
	"$schema": "./../../../schemas/Aurora.schema.json",
	"audit_history": [
		{
			"user": "copilot",
			"event": "created",
			"timestamp": "2026-01-08T00:00:00Z"
		},
		{
			"user": "copilot",
			"event": "edited",
			"timestamp": "2026-01-10T00:00:00Z"
		}
	],
	"card_type": "capability",
	"description": "Enable a customer to place a fast-food order from a mobile device and receive confirmation and status updates.",
	"id": "place_order",
	"links": [
		{
			"relationship": "satisfies",
			"target": "7d24d5e6-d5ef-4a12-8b78-c3456789abcd"
		},
		{
			"relationship": "satisfies",
			"target": "9f46f708-f701-4c34-8d9a-e56789abcdef"
		}
	],
	"name": "Place Order",
	"status": "proposed",
	"uuid": "e4f5a6b7-4c56-4d89-9e8f-3a4b5c6d7e8f",
	"version": "2.0.0"
}
