{
	"$schema": "./../../../schemas/AURORA.schema.json",
	"audit_history": [
		{
			"user": "copilot",
			"event": "created",
			"timestamp": "2026-01-08T00:00:00Z"
		}
	],
	"card_subtype": "zone",
	"card_type": "boundary",
	"description": "Store-controlled environment for POS and kitchen systems that receive and fulfill orders.",
	"id": "store_network",
	"links": [
		{
			"relationship": "contains",
			"target": "0a777777-2222-4e99-8599-555566667777"
		}
	],
	"name": "Store Network Zone",
	"status": "proposed",
	"uuid": "39f091a2-90ab-4e1e-8d34-8901abcde234",
	"version": "1.0.0"
}
