{
	"$schema": "./../../../schemas/AURORA.schema.json",
	"audit_history": [
		{
			"user": "copilot",
			"event": "created",
			"timestamp": "2026-01-08T00:00:00Z"
		}
	],
	"card_type": "requirement",
	"description": "The system shall authorize payment prior to order submission and provide a clear success/failure outcome.",
	"id": "payment_authorization",
	"links": [
		{
			"relationship": "imposes",
			"target": "aaaaaaaa-3333-4e44-8555-333344445555"
		},
		{
			"relationship": "validated_by",
			"target": "1f1e1d1c-1234-4abc-8def-bcdef0123456"
		}
	],
	"name": "Payment Authorization",
	"status": "proposed",
	"uuid": "55555555-eeee-4fff-8000-eeeeffff0000",
	"version": "1.0.0"
}
