{
	"$schema": "./../../../schemas/Aurora.schema.json",
	"audit_history": [
		{
			"user": "copilot",
			"event": "created",
			"timestamp": "2026-01-08T00:00:00Z"
		},
		{
			"user": "copilot",
			"event": "edited",
			"timestamp": "2026-01-10T00:00:00Z"
		}
	],
	"card_type": "constraint",
	"card_subtype": "threat",
	"description": "An attacker or error path could result in orders being submitted without successful payment authorization, creating fraud and revenue loss.",
	"id": "unpaid_or_fraudulent_order_submission",
	"name": "Threat: Unpaid Or Fraudulent Order Submission",
	"status": "proposed",
	"uuid": "23d4e5f6-2222-4b33-8444-bcdef0123456",
	"version": "2.0.0"
}
